<?xml version="1.0" encoding="UTF-8"?>
<dataroot xmlns:od="urn:schemas-microsoft-com:officedata" xmlns:xsi="http://www.w3.org/2001/XMLSchema-instance"  xsi:noNamespaceSchemaLocation="tblEvents.xsd" generated="2026-01-16T06:41:56">
<tblEvents>
<EventID>4</EventID>
<DateStart>2016-08-27T00:00:00</DateStart>
<DateEnd>2016-08-27T00:00:00</DateEnd>
<City>Gothenburg</City>
<Country>Sweden</Country>
<EventName>SQL Saturday #536</EventName>
<EventStatus>Accepted</EventStatus>
<IsRemote>0</IsRemote>
<MVPKind>Speaking (Conference)</MVPKind>
</tblEvents>
<tblEvents>
<EventID>17</EventID>
<DateStart>2016-09-03T00:00:00</DateStart>
<DateEnd>2016-09-03T00:00:00</DateEnd>
<City>Oslo</City>
<Country>Norway</Country>
<EventName>SQL Saturday #532</EventName>
<EventStatus>Rejected</EventStatus>
<IsRemote>0</IsRemote>
<MVPKind>Speaking (Conference)</MVPKind>
</tblEvents>
<tblEvents>
<EventID>19</EventID>
<DateStart>2016-09-10T00:00:00</DateStart>
<DateEnd>2016-09-10T00:00:00</DateEnd>
<City>Cambridge</City>
<Country>United Kingdom</Country>
<EventName>SQL Saturday #520</EventName>
<EventStatus>Rejected</EventStatus>
<IsRemote>0</IsRemote>
<MVPKind>Speaking (Conference)</MVPKind>
</tblEvents>
<tblEvents>
<EventID>5</EventID>
<DateStart>2016-11-16T00:00:00</DateStart>
<DateEnd>2016-11-17T00:00:00</DateEnd>
<City>Stockholm</City>
<Country>Sweden</Country>
<EventName>TechDays Sweden</EventName>
<EventStatus>Accepted</EventStatus>
<IsRemote>0</IsRemote>
<MVPKind>Speaking (Conference)</MVPKind>
</tblEvents>
<tblEvents>
<EventID>18</EventID>
<DateStart>2017-02-25T00:00:00</DateStart>
<DateEnd>2017-02-25T00:00:00</DateEnd>
<City>Pordenone</City>
<Country>Italy</Country>
<EventName>SQL Saturday #589</EventName>
<EventStatus>Rejected</EventStatus>
<IsRemote>0</IsRemote>
<MVPKind>Speaking (Conference)</MVPKind>
</tblEvents>
<tblEvents>
<EventID>16</EventID>
<DateStart>2017-03-11T00:00:00</DateStart>
<DateEnd>2017-03-11T00:00:00</DateEnd>
<City>Lisbon</City>
<Country>Portugal</Country>
<EventName>SQL Saturday #583</EventName>
<EventStatus>Rejected</EventStatus>
<IsRemote>0</IsRemote>
<MVPKind>Speaking (Conference)</MVPKind>
</tblEvents>
<tblEvents>
<EventID>22</EventID>
<DateStart>2017-03-18T00:00:00</DateStart>
<DateEnd>2017-03-18T00:00:00</DateEnd>
<City>Reykjavik</City>
<Country>Iceland</Country>
<EventName>SQL Saturday #602</EventName>
<EventStatus>Rejected</EventStatus>
<IsRemote>0</IsRemote>
<MVPKind>Speaking (Conference)</MVPKind>
</tblEvents>
<tblEvents>
<EventID>21</EventID>
<DateStart>2017-03-18T00:00:00</DateStart>
<DateEnd>2017-03-18T00:00:00</DateEnd>
<City>Belgrade</City>
<Country>Serbia</Country>
<EventName>SQL Saturday #601</EventName>
<EventStatus>Rejected</EventStatus>
<IsRemote>0</IsRemote>
<MVPKind>Speaking (Conference)</MVPKind>
</tblEvents>
<tblEvents>
<EventID>6</EventID>
<DateStart>2017-05-18T00:00:00</DateStart>
<DateEnd>2017-05-18T00:00:00</DateEnd>
<City>Linköping</City>
<Country>Sweden</Country>
<EventName>.NET User Group Meeting</EventName>
<EventStatus>Accepted</EventStatus>
<IsRemote>0</IsRemote>
<MVPKind>Speaking (Conference)</MVPKind>
</tblEvents>
<tblEvents>
<EventID>23</EventID>
<DateStart>2017-05-20T00:00:00</DateStart>
<DateEnd>2017-05-20T00:00:00</DateEnd>
<City>Kyiv</City>
<Country>Ukraine</Country>
<EventName>SQL Saturday #616</EventName>
<EventStatus>Rejected</EventStatus>
<IsRemote>0</IsRemote>
<MVPKind>Speaking (Conference)</MVPKind>
</tblEvents>
<tblEvents>
<EventID>20</EventID>
<DateStart>2017-05-27T00:00:00</DateStart>
<DateEnd>2017-05-27T00:00:00</DateEnd>
<City>Plovdiv</City>
<Country>Bulgaria</Country>
<EventName>SQL Saturday #599</EventName>
<EventStatus>Rejected</EventStatus>
<IsRemote>0</IsRemote>
<MVPKind>Speaking (Conference)</MVPKind>
</tblEvents>
<tblEvents>
<EventID>25</EventID>
<DateStart>2017-09-02T00:00:00</DateStart>
<DateEnd>2017-09-02T00:00:00</DateEnd>
<City>Oslo</City>
<Country>Norway</Country>
<EventName>SQL Saturday #667</EventName>
<EventStatus>Rejected</EventStatus>
<IsRemote>0</IsRemote>
<MVPKind>Speaking (Conference)</MVPKind>
</tblEvents>
<tblEvents>
<EventID>24</EventID>
<DateStart>2017-09-16T00:00:00</DateStart>
<DateEnd>2017-09-16T00:00:00</DateEnd>
<City>Toulouse</City>
<Country>France</Country>
<EventName>SQL Saturday #658</EventName>
<EventStatus>Rejected</EventStatus>
<IsRemote>0</IsRemote>
<MVPKind>Speaking (Conference)</MVPKind>
</tblEvents>
<tblEvents>
<EventID>7</EventID>
<DateStart>2017-09-23T00:00:00</DateStart>
<DateEnd>2017-09-23T00:00:00</DateEnd>
<City>Gothenburg</City>
<Country>Sweden</Country>
<EventName>SQL Saturday #657</EventName>
<EventStatus>Accepted</EventStatus>
<IsRemote>0</IsRemote>
<MVPKind>Speaking (Conference)</MVPKind>
</tblEvents>
<tblEvents>
<EventID>29</EventID>
<DateStart>2017-10-25T00:00:00</DateStart>
<DateEnd>2017-10-25T00:00:00</DateEnd>
<City>Stockholm</City>
<Country>Sweden</Country>
<EventName>TechDays Sweden</EventName>
<EventStatus>Rejected</EventStatus>
<IsRemote>0</IsRemote>
<MVPKind>Speaking (Conference)</MVPKind>
</tblEvents>
<tblEvents>
<EventID>26</EventID>
<DateStart>2017-11-18T00:00:00</DateStart>
<DateEnd>2017-11-18T00:00:00</DateEnd>
<City>Talinn</City>
<Country>Latvia</Country>
<EventName>SQL Saturday #668</EventName>
<EventStatus>Rejected</EventStatus>
<IsRemote>0</IsRemote>
<MVPKind>Speaking (Conference)</MVPKind>
</tblEvents>
<tblEvents>
<EventID>8</EventID>
<DateStart>2017-11-27T00:00:00</DateStart>
<DateEnd>2017-11-27T00:00:00</DateEnd>
<City>Stockholm</City>
<Country>Sweden</Country>
<EventName>SQL UG</EventName>
<EventStatus>Accepted</EventStatus>
<IsRemote>0</IsRemote>
<MVPKind>Speaking (User Group)</MVPKind>
</tblEvents>
<tblEvents>
<EventID>9</EventID>
<DateStart>2018-01-19T00:00:00</DateStart>
<DateEnd>2018-01-19T00:00:00</DateEnd>
<City>Vienna</City>
<Country>Austria</Country>
<EventName>SQL Saturday #679</EventName>
<EventStatus>Accepted</EventStatus>
<IsRemote>0</IsRemote>
<MVPKind>Speaking (Conference)</MVPKind>
</tblEvents>
<tblEvents>
<EventID>10</EventID>
<DateStart>2018-01-30T00:00:00</DateStart>
<DateEnd>2018-02-02T00:00:00</DateEnd>
<City>Oslo</City>
<Country>Norway</Country>
<EventName>Nordic Infrastructure Conference</EventName>
<EventStatus>Accepted</EventStatus>
<IsRemote>0</IsRemote>
<MVPKind>Speaking (Conference)</MVPKind>
</tblEvents>
<tblEvents>
<EventID>11</EventID>
<DateStart>2018-03-10T00:00:00</DateStart>
<DateEnd>2018-03-10T00:00:00</DateEnd>
<City>Reykjavik</City>
<Country>Iceland</Country>
<EventName>SQL Saturday #704</EventName>
<EventStatus>Accepted</EventStatus>
<IsRemote>0</IsRemote>
<MVPKind>Speaking (Conference)</MVPKind>
</tblEvents>
<tblEvents>
<EventID>14</EventID>
<DateStart>2018-03-14T00:00:00</DateStart>
<DateEnd>2018-03-14T00:00:00</DateEnd>
<City>Antwerp</City>
<Country>Belgium</Country>
<EventName>IT Proud</EventName>
<EventStatus>Accepted</EventStatus>
<IsRemote>0</IsRemote>
<MVPKind>Speaking (Conference)</MVPKind>
</tblEvents>
<tblEvents>
<EventID>12</EventID>
<DateStart>2018-03-21T00:00:00</DateStart>
<DateEnd>2018-03-22T00:00:00</DateEnd>
<City>Helsinki</City>
<Country>Finland</Country>
<EventName>TechDays Finland</EventName>
<EventStatus>Accepted</EventStatus>
<IsRemote>0</IsRemote>
<MVPKind>Speaking (Conference)</MVPKind>
</tblEvents>
<tblEvents>
<EventID>13</EventID>
<DateStart>2018-04-21T00:00:00</DateStart>
<DateEnd>2018-04-21T00:00:00</DateEnd>
<City>Linköping</City>
<Country>Sweden</Country>
<EventName>Global Azure Bootcamp</EventName>
<EventStatus>Accepted</EventStatus>
<IsRemote>0</IsRemote>
<MVPKind>Speaking (Local)</MVPKind>
</tblEvents>
<tblEvents>
<EventID>15</EventID>
<DateStart>2018-04-26T00:00:00</DateStart>
<DateEnd>2018-04-26T00:00:00</DateEnd>
<City>Tel Aviv</City>
<Country>Israel</Country>
<EventName>SQL Saturday #738</EventName>
<EventStatus>Accepted</EventStatus>
<IsRemote>0</IsRemote>
<MVPKind>Speaking (Conference)</MVPKind>
</tblEvents>
<tblEvents>
<EventID>39</EventID>
<DateStart>2018-05-12T00:00:00</DateStart>
<DateEnd>2018-05-12T00:00:00</DateEnd>
<City>Helsinki</City>
<Country>Finland</Country>
<EventName>SQL Saturday #735</EventName>
<EventStatus>Accepted</EventStatus>
<IsRemote>0</IsRemote>
<MVPKind>Speaking (Conference)</MVPKind>
</tblEvents>
<tblEvents>
<EventID>28</EventID>
<DateStart>2018-05-22T00:00:00</DateStart>
<DateEnd>2018-05-24T00:00:00</DateEnd>
<City>Antwerp</City>
<Country>Belgium</Country>
<EventName>Techorama BE 2018</EventName>
<EventStatus>Rejected</EventStatus>
<IsRemote>0</IsRemote>
<MVPKind>Speaking (Conference)</MVPKind>
</tblEvents>
<tblEvents>
<EventID>36</EventID>
<DateStart>2018-05-26T00:00:00</DateStart>
<DateEnd>2018-05-26T00:00:00</DateEnd>
<City>Munich</City>
<Country>Germany</Country>
<EventName>Azure Saturday</EventName>
<EventStatus>Accepted</EventStatus>
<IsRemote>0</IsRemote>
<MVPKind>Speaking (Conference)</MVPKind>
</tblEvents>
<tblEvents>
<EventID>35</EventID>
<DateStart>2018-05-29T00:00:00</DateStart>
<DateEnd>2018-05-30T00:00:00</DateEnd>
<City>Copenhagen</City>
<Country>Denmark</Country>
<EventName>Intelligent Cloud Conference</EventName>
<EventStatus>Accepted</EventStatus>
<IsRemote>0</IsRemote>
<MVPKind>Speaking (Conference)</MVPKind>
</tblEvents>
<tblEvents>
<EventID>38</EventID>
<DateStart>2018-05-29T00:00:00</DateStart>
<DateEnd>2018-05-31T00:00:00</DateEnd>
<City>Riga</City>
<Country>Latvia</Country>
<EventName>Riga DevDays 2018</EventName>
<EventStatus>Rejected</EventStatus>
<IsRemote>0</IsRemote>
<MVPKind>Speaking (Conference)</MVPKind>
</tblEvents>
<tblEvents>
<EventID>31</EventID>
<DateStart>2018-06-09T00:00:00</DateStart>
<DateEnd>2018-06-09T00:00:00</DateEnd>
<City>Cork</City>
<Country>Ireland</Country>
<EventName>SQL Saturday #742</EventName>